{
  "eventId": "00000000-0000-4000-8000-000000000001",
  "eventType": "OrderCreated",
  "eventVersion": 1,
  "aggregateId": "10000000-0000-4000-8000-000000000007",
  "correlationId": "10000000-0000-4000-8000-000000000007",
  "occurredAt": "2026-10-30T12:00:00Z",
  "payload": {
    "items": [
      {
        "productId": "flowops-demo-v1-declined",
        "quantity": 1
      }
    ]
  }
}
